{
  "set_id":             "breakpoints_D17_PASS_v1",
  "entity_type":        "breakpoint",
  "label":              "Breakpoints of D17 PASS inversions",
  "path":               "sets/breakpoint/D17_PASS.breakpoints.tsv",
  "n_entities":         94,
  "parent_set_id":      "candidates_D17_PASS_v1",
  "coordinate_system":  "fClaHyb_Gar_LG_v1",
  "intended_use":       "TE / SD substrate analysis",
  "status":             "active",
  "created_at":         "2026-04-25T09:30:00Z"
}
