{
  "set_id":            "samples_broodstock226_v1",
  "entity_type":       "sample",
  "label":             "Broodstock 226 — all sequenced individuals",
  "path":              "sets/sample/broodstock226.tsv",
  "n_entities":        226,
  "hash":              "sha256:e9c071a4a26f0c98c1ee0a5f3b39b3e1d77a8c2f4a5b7b9e6d3a4c1e9d7b2f50",
  "parent_set_id":     "all_samples_v1",
  "intended_use":      "population genomics, ngsRelate, ngsAdmix",
  "status":            "active",
  "created_at":        "2026-02-04T00:00:00Z"
}
