{
  "set_id":             "sites_wholegenome_thin1k_v1",
  "entity_type":        "variant_site",
  "label":              "Whole-genome sites — MAF≥0.05, thinned to 1 SNP / kb",
  "path":               "sets/variant_site/wholegenome.thin1k.sites.tsv.gz",
  "n_entities":         1289400,
  "hash":               "sha256:91b3d4a7e2f80165aabbccdd11ee22ff3344556677889900aabbccddeeff0011",
  "parent_set_id":      "snps_maf005_v1",
  "filter_profile_id":  "maf005_thin1k_v1",
  "coordinate_system":  "fClaHyb_Gar_LG_v1",
  "intended_use":       "ngsRelate / ngsAdmix whole-genome runs",
  "status":             "active",
  "created_at":         "2026-04-10T12:00:00Z"
}
